id,title_en,title_zh,source_type,institution,date,topics,jurisdiction,language,url,doi_or_isbn,citation,summary,significance_note
tt-2024-ep-eu-china-derisking,EU-China Relations - De-risking or De-coupling,,Think tank report,European Parliament Think Tank,2024-03-26,global-economic-system;sanctions-anti-sanctions;theory-order,Foreign,English,https://www.europarl.europa.eu/thinktank/en/document/EXPO_STU%282024%29754446,,European Parliament - EU-China relations - De-risking or de-coupling - 2024,Study on EU strategy toward China and de-risking,Useful comparative policy source for economic security and legal instruments
tt-2024-china-russia-alignment-europe,China-Russia Alignment - A Threat to Europe's Security,,Think tank report,Chatham House and GMF and MERICS,2024-06-26,theory-order;use-of-force;sanctions-anti-sanctions,Foreign,English,https://www.gmfus.org/sites/default/files/2024-06/Chatham%20House%20GMF%20MERICS%20Report%20China-Russia%20alignment_06-2024.pdf,,Chatham House GMF and MERICS - China-Russia alignment - 2024,Joint report on China-Russia alignment and implications for European security,Adds context for sanctions UN voting and security order debates
tt-2024-carnegie-global-economic-governance,Reimagining Global Economic Governance,,Think tank report,Carnegie Endowment for International Peace,2024-09-01,global-economic-system;theory-order,Foreign,English,https://assets.carnegieendowment.org/static/files/Patrick%20et%20al%20-%20Reimagining%20Global%20Economic%20Governance.pdf,,Carnegie Endowment - Reimagining Global Economic Governance - 2024,Report on reforming global economic governance amid US-China rivalry,Useful for IMF WTO and development finance order reform materials
tt-2025-brookings-iomed,The Purpose and Promise of China's International Organization for Mediation,,Think tank report,Brookings Institution,2025-06-01,dispute-settlement;one-country-two-systems;theory-order,Foreign,English,https://www.brookings.edu/articles/the-purpose-and-promise-of-chinas-international-organization-for-mediation/,,Brookings Institution - The purpose and promise of China's International Organization for Mediation - 2025,Analysis of China's new mediation organization and its possible role,Directly supports the China-centred dispute settlement guide
tt-2025-austchina-iomed,China's Mediation Initiative and Australia,,Think tank report,AustChina Institute,2025-06-01,dispute-settlement;one-country-two-systems;global-economic-system,Foreign,English,https://www.aci.org.au/publications/article_china-mediation-initiative-IOMed,,AustChina Institute - China's Mediation Initiative and Australia - 2025,Policy analysis on Australia and the International Organization for Mediation,Adds regional perspective on IOMed engagement choices
lit-2025-ia-rising-states-liberal-order,Rising States and the Liberal World Order - The Case of China,,Literature,Steve Chan and Weixing Hu,2025-03-03,theory-order;use-of-force;sovereignty-non-interference,Scholarly literature,English,https://academic.oup.com/ia/article/101/2/381/8004978,10.1093/ia/iiae330,Steve Chan and Weixing Hu - Rising states and the liberal world order - International Affairs - 2025,Article testing claims that a rising China threatens international peace and order,Adds a recent IR counterpoint to deterministic power-transition accounts
lit-2024-jcc-human-rights-world-order,Institutional Design and Rhetorical Spaces - China's Human Rights Strategies in a Changing World Order,,Literature,Rosemary Foot,2024-01-04,theory-order;sovereignty-non-interference,Scholarly literature,English,https://www.tandfonline.com/doi/abs/10.1080/10670564.2023.2299958,10.1080/10670564.2023.2299958,Rosemary Foot - Institutional Design and Rhetorical Spaces - Journal of Contemporary China - 2024,Article on China's human rights strategies within changing global order institutions,Useful for the sovereignty and non-interference dossier on human rights contestation
lit-2023-pacific-review-do-as-i-do,China's Do-as-I-do Paradigm - Practice-based Normative Diplomacy in the Global South,,Literature,Jeremy Garlick and Fangxing Qin,2023-12-09,theory-order;sovereignty-non-interference;belt-and-road,Scholarly literature,English,https://www.tandfonline.com/doi/abs/10.1080/09512748.2023.2290619,10.1080/09512748.2023.2290619,Jeremy Garlick and Fangxing Qin - China's do-as-I-do paradigm - The Pacific Review - 2023,Article on Chinese norm diffusion through practice-based diplomacy in the Global South,Connects BRI-era diplomacy with non-interference and One China norm promotion
lit-2022-ir-liberal-order-networks,Is the Liberal Order on the Way Out - China's Rise Networks and the Liberal Hegemon,,Literature,Deborah Welch Larson,2022-06-28,theory-order;global-economic-system,Scholarly literature,English,https://journals.sagepub.com/doi/10.1177/00471178221109002,10.1177/00471178221109002,Deborah Welch Larson - Is the liberal order on the way out - International Relations - 2022,Article using network analysis to assess China's rise and the resilience of liberal order,Adds a structural IR account of order change beyond legal doctrine
lit-2022-pacific-review-contestation-lio,China's Contestation of the Liberal International Order,,Literature,Sung-han Kim and Sanghoon Kim,2022-04-09,theory-order;global-economic-system;sovereignty-non-interference,Scholarly literature,English,https://www.tandfonline.com/doi/abs/10.1080/09512748.2022.2063367,10.1080/09512748.2022.2063367,Sung-han Kim and Sanghoon Kim - China's contestation of the liberal international order - The Pacific Review - 2022,Article on revisionism and the domains in which China contests liberal order,Sharpens the corpus distinction between selective contestation and wholesale replacement
lit-2023-cjip-southeast-asia-order-transition,Southeast Asia Amid Sino-US Competition - Power Shift and Regional Order Transition,,Literature,Wen Zha,2023-05-16,theory-order;use-of-force;belt-and-road,Scholarly literature,English,https://academic.oup.com/cjip/article/16/2/241/7165249,10.1093/cjip/poad006,Wen Zha - Southeast Asia amid Sino-US competition - Chinese Journal of International Politics - 2023,Article reviewing regional debates over Sino-US competition and Southeast Asian order,Adds regional order evidence for BRI security and ASEAN-centered materials
lit-2022-cjcl-approach-international-law,China's Approach to International Law - From Traditional Westphalianism to Aggressive Instrumentalism in the Xi Jinping Era,,Literature,Jiangyu Wang and Huaer Cheng,2022-05-12,theory-order;sovereignty-non-interference,Scholarly literature,English,https://academic.oup.com/cjcl/article/10/1/140/6585033,10.1093/cjcl/cxac020,Jiangyu Wang and Huaer Cheng - China's approach to international law - Chinese Journal of Comparative Law - 2022,Article characterizing China's Xi-era international legal stance as aggressive instrumentalism,Core recent source for general theories of China's engagement with international law
lit-2022-twq-rising-power-status-quo,China as a Rising Power - Why the Status Quo Matters,,Literature,Ian Taylor and Zhangxi Cheng,2022-01-02,theory-order;global-economic-system,Scholarly literature,English,https://www.tandfonline.com/doi/full/10.1080/01436597.2021.2005462,10.1080/01436597.2021.2005462,Ian Taylor and Zhangxi Cheng - China as a rising power - Third World Quarterly - 2022,Article arguing that the status quo matters for understanding China's rise,Useful corrective to simple revisionist or revolutionary readings of Chinese order behavior
lit-2020-jiel-selective-reshaping,Selective Reshaping - China's Paradigm Shift in International Economic Governance,,Literature,Heng Wang,2020-10-28,global-economic-system;belt-and-road;theory-order,Scholarly literature,English,https://academic.oup.com/jiel/article/23/3/583/5902817,10.1093/jiel/jgaa021,Heng Wang - Selective Reshaping - Journal of International Economic Law - 2020,Article developing selective reshaping as a framework for China's international economic governance,Important international economic law theory for BRI and institutional reform debates
lit-2019-jiel-geoeconomic-order,Toward a Geoeconomic Order in International Trade and Investment,,Literature,Anthea Roberts and Henrique Choer Moraes and Victor Ferguson,2019-10-02,global-economic-system;sanctions-anti-sanctions;theory-order,Scholarly literature,English,https://doi.org/10.1093/jiel/jgz036,10.1093/jiel/jgz036,Roberts Moraes and Ferguson - Toward a Geoeconomic Order - Journal of International Economic Law - 2019,Article on the move from neoliberal economic order toward geoeconomic ordering,Frames US-China trade and technology rivalry as a legal-economic order transition
lit-2019-ripe-varieties-contestation,Varieties of Contestation - China's Rise and the Liberal Trade Order,,Literature,Clara Weinhardt and Tobias Ten Brink,2019-12-10,global-economic-system;theory-order,Scholarly literature,English,https://www.tandfonline.com/doi/full/10.1080/09692290.2019.1699145,10.1080/09692290.2019.1699145,Clara Weinhardt and Tobias Ten Brink - Varieties of contestation - Review of International Political Economy - 2019,Article distinguishing forms of China's contestation in the liberal trade order,Useful for separating institutional adaptation from deeper normative challenge
lit-2020-cria-contesting-liberal-internationalism,Contesting Liberal Internationalism - China's Renegotiation of World Order,,Literature,Pak K Lee and Anisa Heritage and Zhouchen Mao,2020-01-02,theory-order;global-economic-system;sovereignty-non-interference,Scholarly literature,English,https://www.tandfonline.com/doi/full/10.1080/09557571.2020.1715682,10.1080/09557571.2020.1715682,Lee Heritage and Mao - Contesting liberal internationalism - Cambridge Review of International Affairs - 2020,Article on China's renegotiation of world order and liberal internationalism,Adds a sustained IR account of selective renegotiation across institutions and norms
lit-2018-cria-tianxia-philadelphian,Competing Visions of a Postmodern World Order - The Philadelphian System Versus the Tianxia System,,Literature,Taesuh Cha,2018-09-03,theory-order;sovereignty-non-interference,Scholarly literature,English,https://www.tandfonline.com/doi/full/10.1080/09557571.2018.1536113,10.1080/09557571.2018.1536113,Taesuh Cha - Competing visions of a postmodern world order - Cambridge Review of International Affairs - 2018,Article comparing liberal constitutional and Tianxia-inflected conceptions of order,Adds conceptual background for Chinese world-order theory debates
lit-2018-ia-us-china-liberal-world-order,US-China Relations and the Liberal World Order - Contending Elites Colliding Visions,,Literature,Nana de Graaff and Bastiaan van Apeldoorn,2018-01-01,theory-order;global-economic-system,Scholarly literature,English,https://academic.oup.com/ia/article/94/1/113/4762687,10.1093/ia/iix232,Nana de Graaff and Bastiaan van Apeldoorn - US-China relations and the liberal world order - International Affairs - 2018,Article comparing elite visions of US-China relations and the liberal world order,Useful for tracing how order conflict is mediated through transnational elite projects
lit-2017-global-governance-security-council-engagement,China's Security Council Engagement - The Impact of Normative and Causal Beliefs,,Literature,Lisa Macleod,2017-08-19,use-of-force;theory-order;sovereignty-non-interference,Scholarly literature,English,https://brill.com/view/journals/gg/23/3/article-p383_4.xml,10.1163/19426720-02303004,Lisa Macleod - China's Security Council engagement - Global Governance - 2017,Article on how beliefs shape China's engagement in the UN Security Council,Connects use-of-force and collective security practice with international order theory
lit-2020-ajil-authoritarian-international-law,Authoritarian International Law,,Literature,Tom Ginsburg,2020-02-03,theory-order;sovereignty-non-interference,Scholarly literature,English,https://www.cambridge.org/core/product/FEE3604900EE3EF547B5A87BEA265571,10.1017/ajil.2020.3,Tom Ginsburg - Authoritarian International Law - American Journal of International Law - 2020,Article theorizing how authoritarian states may reshape international legal norms and institutions,Useful comparative frame for assessing whether China is changing international law's liberal premises
lit-2022-jwt-special-economic-zones-order,Special Economic Zones - The Subnational-National-International Nexus in China's Integration With the International Economic Order,,Literature,Chenxi Wang,2022-12-01,global-economic-system;theory-order,Scholarly literature,English,https://kluwerlawonline.com/journalarticle/Journal+of+World+Trade/56.6/TRAD2022042,10.54648/TRAD2022042,Chenxi Wang - Special Economic Zones - Journal of World Trade - 2022,Article on special economic zones and China's integration with the international economic order,Adds subnational legal-economic infrastructure to the global economic system dossier
lit-2023-ejil-rao-geping-international-organizations,International Institutions as Forms and Fora - Rao Geping and the Law of International Organizations in China,,Literature,Yifeng Chen,2023-11-13,theory-order;dispute-settlement,Scholarly literature,English,https://academic.oup.com/ejil/article/34/4/855/7416677,10.1093/ejil/chad056,Yifeng Chen - International Institutions as Forms and Fora - European Journal of International Law - 2023,Article on Rao Geping and the Chinese discipline of international organizations law,Adds intellectual history of China's institutionalist approach to international organizations
lit-2023-orbis-foreign-related-rule-law,Foreign Policy Implications for China's Foreign-Related Rule of Law,,Literature,Matthew Erie,2023-08-01,theory-order;sanctions-anti-sanctions;global-economic-system,Scholarly literature,English,https://www.sciencedirect.com/science/article/abs/pii/S0030438723000406,10.1016/j.orbis.2023.08.006,Matthew Erie - Foreign policy implications for China's foreign-related rule of law - Orbis - 2023,Article on China's foreign-related rule of law reform and foreign policy implications,Supports analysis of legal statecraft after trade war sanctions and BRI legal export debates
lit-2024-jcc-china-russia-reexaminations,Chinese Re-Examinations of Russia - The Strategic Partnership in the Wake of Russia's War Against Ukraine,,Literature,Rebekka Asnes Sagild and Christopher Weidacher Hsiung,2024-06-18,use-of-force;theory-order;sovereignty-non-interference,Scholarly literature,English,https://www.tandfonline.com/doi/full/10.1080/10670564.2024.2358876,10.1080/10670564.2024.2358876,Sagild and Hsiung - Chinese Re-Examinations of Russia - Journal of Contemporary China - 2024,Article on Chinese debates over Russia after the full-scale invasion of Ukraine,Adds recent evidence on China-Russia alignment and the security order after 2022
lit-2024-china-information-standards-ground-up,Chinese Standards From the Ground Up,,Literature,Miriam Driessen and Ruiyi Zhu,2024-04-24,global-economic-system;belt-and-road;theory-order,Scholarly literature,English,https://journals.sagepub.com/doi/10.1177/0920203X241248412,10.1177/0920203X241248412,Miriam Driessen and Ruiyi Zhu - Chinese standards from the ground up - China Information - 2024,Article on China's transformation from standards-taker to global standards-maker,Adds socio-legal texture to China's role in standards and technical governance
lit-2018-uilr-china-rise-wto,China's Rise - How It Took on the US at the WTO,,Literature,Gregory Shaffer and Henry Gao,2018-01-01,global-economic-system;dispute-settlement;theory-order,Scholarly literature,English,https://papers.ssrn.com/sol3/papers.cfm?abstract_id=2937965,,Gregory Shaffer and Henry Gao - China's Rise - University of Illinois Law Review - 2018,Article on China's trade law capacity and use of WTO dispute settlement against the United States and Europe,Key international economic law source on China's move from rule-taker to serious legal actor
lit-2025-ajil-unbound-bandung-common-destiny,From Asian-African Solidarity to a Community of Common Destiny - An Evolving Chinese Perspective of the International Legal Order,,Literature,Bing Bing Jia,2025-10-20,theory-order;sovereignty-non-interference;global-economic-system,Scholarly literature,English,https://doi.org/10.1017/aju.2025.10023,10.1017/aju.2025.10023,Bing Bing Jia - From Asian-African Solidarity to a Community of Common Destiny - AJIL Unbound - 2025,Essay tracing how Bandung principles shape Chinese views of international legal order,Connects decolonization non-interference and community of common destiny language
lit-2021-io-domestic-politics-china-rise-lio,"Domestic Politics, China's Rise, and the Future of the Liberal International Order",,Literature,Jessica Chen Weiss and Jeremy L Wallace,2021-03-23,theory-order;global-economic-system;sovereignty-non-interference,Scholarly literature,English,https://www.cambridge.org/core/journals/international-organization/article/abs/domestic-politics-chinas-rise-and-the-future-of-the-liberal-international-order/9EBC39D04A8B21FECB2BC7BD4D415C43,10.1017/S002081832000048X,"Jessica Chen Weiss and Jeremy L Wallace - Domestic Politics, China's Rise, and the Future of the Liberal International Order - International Organization - 2021",Article explaining how Chinese domestic politics shape selective engagement with liberal order,Useful for linking sovereignty markets climate arms control and humanitarian intervention
lit-2019-isec-china-world-orders,China in a World of Orders - Rethinking Compliance and Challenge in Beijing's International Relations,,Literature,Alastair Iain Johnston,2019-10-01,theory-order;global-economic-system;sovereignty-non-interference;use-of-force,Scholarly literature,English,https://direct.mit.edu/isec/article/44/2/9/12242/China-in-a-World-of-Orders-Rethinking-Compliance,10.1162/isec_a_00360,Alastair Iain Johnston - China in a World of Orders - International Security - 2019,Article arguing that China's behavior varies across multiple international orders,Core framework for avoiding overbroad claims about a single liberal order challenge
lit-2017-ris-canary-unga-world-order,"Canary in the Coal Mine? China, the UNGA, and the Changing World Order",,Literature,Samuel Brazys and Alexander Dukalskis,2017-02-20,theory-order;sovereignty-non-interference;global-economic-system,Scholarly literature,English,https://www.aiddata.org/publications/canary-in-the-coal-mine-china-the-unga-and-the-changing-world-order,10.1017/S0260210517000067,"Samuel Brazys and Alexander Dukalskis - Canary in the Coal Mine? China, the UNGA, and the Changing World Order - Review of International Studies - 2017",Article using UN General Assembly voting to examine China's influence on global norms,Important empirical source on sovereignty democracy non-interference and human rights voting
lit-2023-ssci-international-law-based-order,On the International Law-Based International Order,,Literature,Cai Congyan,2023-09-27,theory-order;sovereignty-non-interference;dispute-settlement,Scholarly literature,English,https://www.tandfonline.com/doi/abs/10.1080/02529203.2023.2254108,10.1080/02529203.2023.2254108,Cai Congyan - On the International Law-Based International Order - Social Sciences in China - 2023,Article contrasting China-backed international law-based order with rules-based order discourse,Direct source for China's legal framing of order around the UN Charter and universal international law
lit-2025-pacific-review-transnational-policy-forums,Beyond Multilateralism - China's International Order Building Through Transnational Policy Forums,,Literature,Matthew D Stephen,2025-11-26,theory-order;belt-and-road;global-economic-system;sovereignty-non-interference,Scholarly literature,English,https://www.tandfonline.com/doi/full/10.1080/09512748.2025.2590512,10.1080/09512748.2025.2590512,Matthew D Stephen - Beyond Multilateralism - The Pacific Review - 2025,Article on China's use of transnational policy forums to build order beyond formal institutions,Adds informal elite and public-facing mechanisms to the order-building corpus
lit-2024-security-studies-collective-logic-hegemonic-order,The Collective Logic of Chinese Hegemonic Order,,Literature,Amy King,2024-02-29,theory-order;global-economic-system;use-of-force,Scholarly literature,English,https://www.tandfonline.com/doi/full/10.1080/09636412.2023.2253148,10.1080/09636412.2023.2253148,Amy King - The Collective Logic of Chinese Hegemonic Order - Security Studies - 2024,Exchange essay on China hegemony and order transition,Useful complement to illiberal hegemony debates and historical order-making comparisons
lit-2026-ia-china-space-order-multiplex,"China, the 'Rise of the Rest' and the Remaking of the International Space Order in a Multiplex World",,Literature,Dimitrios Stroikos,2026-03-09,theory-order;use-of-force;global-economic-system;belt-and-road,Scholarly literature,English,https://academic.oup.com/ia/article/102/2/389/8509040,10.1093/ia/iiaf275,"Dimitrios Stroikos - China, the 'Rise of the Rest' and the Remaking of the International Space Order - International Affairs - 2026",Article applying multiplex world order theory to China and global space governance,Adds outer space as a functional sub-order shaped by China and Global South cooperation
lit-2026-pacific-review-china-partial-space-power,Empire of the Stars-Not Yet - China as a Partial Great Power in Space,,Literature,Dimitrios Stroikos,2026-01-12,theory-order;use-of-force;global-economic-system,Scholarly literature,English,https://www.tandfonline.com/doi/abs/10.1080/09512748.2025.2610343,10.1080/09512748.2025.2610343,Dimitrios Stroikos - Empire of the Stars-Not Yet - The Pacific Review - 2026,Article assessing China's material and social power in outer space,Useful for distinguishing capability from norm-setting influence in space order
lit-2026-ia-ai-tech-transfer-global-south,The US as 'Leader' and China as 'Collaborator' - AI Technology Transfer and Technological Advancement in the Global South,,Literature,Yiyi Chen and Zikang Chen and Na Yang,2026-03-09,global-economic-system;theory-order;belt-and-road;sovereignty-non-interference,Scholarly literature,English,https://academic.oup.com/ia/advance-article/doi/10.1093/ia/iiaf268/8466321,10.1093/ia/iiaf268,Yiyi Chen and Zikang Chen and Na Yang - The US as 'Leader' and China as 'Collaborator' - International Affairs - 2026,Article comparing US and Chinese AI technology transfer models in the Global South,Adds technology governance and digital sovereignty to the economic order materials
lit-2024-area-dev-policy-china-economic-multipolar,China's Evolving International Economic Engagement - China Threat or a New Pole in an Equitable Multipolar World Order,,Literature,Michael Dunford and Weidong Liu,2023-07-05,global-economic-system;theory-order;belt-and-road,Scholarly literature,English,https://www.tandfonline.com/doi/full/10.1080/23792949.2023.2225092,10.1080/23792949.2023.2225092,Michael Dunford and Weidong Liu - China's evolving international economic engagement - Area Development and Policy - 2024,Article assessing China's trade investment finance and development engagement in a multipolar order,Useful for comparing threat narratives with development-centered economic-order accounts
tt-2024-atlantic-council-global-south-chinese-characteristics,A Global South with Chinese Characteristics,,Think tank report,Atlantic Council,2024-06-13,theory-order;global-economic-system;belt-and-road;sovereignty-non-interference,Foreign,English,https://www.atlanticcouncil.org/in-depth-research-reports/report/a-global-south-with-chinese-characteristics/,,Niva Yau - A Global South with Chinese Characteristics - Atlantic Council - 2024,Report on Chinese training programs and governance-model promotion in the Global South,Important policy source on authoritarian governance diffusion and order competition
tt-2026-carnegie-china-pivot-global-ai,China's Pivot on Global AI,,Think tank report,Carnegie Endowment for International Peace,2026-05-21,global-economic-system;theory-order;sovereignty-non-interference,Foreign,English,https://carnegieendowment.org/research/2026/05/chinas-pivot-on-global-ai,,Arindrajit Basu - China's Pivot on Global AI - Carnegie Endowment for International Peace - 2026,Essay on China's shift from AI infrastructure diplomacy to global AI norm and institution shaping,Adds the latest AI governance diplomacy material to the international order corpus
tt-2024-iiss-gsi-international-policing,The Global Security Initiative - China's International Policing Activities,,Think tank report,International Institute for Strategic Studies,2024-10-24,use-of-force;theory-order;sovereignty-non-interference,Foreign,English,https://www.iiss.org/research-paper/2024/10/the-global-security-initiative-chinas-international-policing-activities/,,IISS - The Global Security Initiative - China's International Policing Activities - 2024,Research report on Chinese international policing under the Global Security Initiative,Shows how security cooperation operationalizes China's alternative security-order claims
tt-2025-carnegie-world-cop-gsi,A New World Cop on the Beat - China's Internal Security Outreach Under the Global Security Initiative,,Think tank report,Carnegie Endowment for International Peace,2025-08-06,use-of-force;theory-order;sovereignty-non-interference,Foreign,English,https://carnegieendowment.org/research/2025/08/a-new-world-cop-on-the-beat-chinas-internal-security-outreach-under-the-global-security-initiative?lang=en,,Sheena Chestnut Greitens Isaac B Kardon and Cameron Waltz - A New World Cop on the Beat - Carnegie Endowment for International Peace - 2025,Report mapping China's nonmilitary security diplomacy and Global Security Initiative architecture,Adds detailed evidence on policing law-enforcement cooperation and security norms
