id,title_en,title_zh,source_type,institution,date,topics,jurisdiction,language,url,doi_or_isbn,citation,summary,significance_note
tt-2024-atlantic-council-tech-competition-global-south,Toward a Coherent Framework for US-China Tech Competition in the Global South,,Think tank report,Atlantic Council,2024-10-18,global-economic-system;theory-order;belt-and-road,Foreign,English,https://www.atlanticcouncil.org/content-series/strategic-insights-memos/toward-a-coherent-framework-for-us-china-tech-competition-in-the-global-south/,,Peter Engelke and Samantha Wong - Toward a coherent framework for US-China tech competition in the Global South - Atlantic Council - 2024,Strategic memo on technology competition and China's alternative vision in the Global South,Useful for AI standards digital infrastructure and Global South order debates
lit-2024-cambridge-handbook-china-intl-law,The Cambridge Handbook of China and International Law,,Literature,Ignacio de la Rasilla and Congyan Cai,2024-01-04,theory-order;sovereignty-non-interference;use-of-force;global-economic-system;dispute-settlement,Scholarly literature,English,https://www.cambridge.org/core/books/cambridge-handbook-of-china-and-international-law/A6058DAE39796BFE4F1CB4FBEAA75DC1,9781316517406,Ignacio de la Rasilla and Congyan Cai eds - The Cambridge Handbook of China and International Law - Cambridge University Press - 2024,Major handbook mapping China's engagement across public international law fields,Useful anchor volume connecting doctrine state practice and order debates
lit-2024-springer-diplomacy-intl-law,China's Diplomacy and International Law,,Literature,Huikang Huang,2024-08-03,theory-order;sovereignty-non-interference;global-economic-system;one-country-two-systems;use-of-force,Scholarly literature,English,https://link.springer.com/book/10.1007/978-981-97-1968-6,9789819719679,Huikang Huang - China's Diplomacy and International Law - Springer - 2024,Book-length statement of contemporary Chinese diplomatic and legal thinking,Important primary-style secondary source on legal diplomacy community of shared future and one country two systems
lit-2020-hart-hk-national-security-rule-law,China's National Security - Endangering Hong Kong's Rule of Law?,,Literature,Cora Chan and Fiona de Londras,2020-03-01,one-country-two-systems;sovereignty-non-interference;dispute-settlement,Scholarly literature,English,https://www.bloomsbury.com/us/chinas-national-security-9781509928170/,9781509955893,Cora Chan and Fiona de Londras eds - China's National Security - Endangering Hong Kong's Rule of Law? - Hart Publishing - 2020,Edited volume on national security legislation constitutionalism and autonomy in Hong Kong,Key book for one country two systems after the national security turn
lit-2024-ds-one-china-policies-taiwan,The Effect of 'One China' Policies of Foreign States on the International Status of Taiwan,,Literature,Mikulas Fabry,2024-03-08,one-country-two-systems;sovereignty-non-interference;theory-order,Scholarly literature,English,https://www.tandfonline.com/doi/full/10.1080/09592296.2024.2303855,10.1080/09592296.2024.2303855,Mikulas Fabry - The Effect of One China Policies of Foreign States on the International Status of Taiwan - Diplomacy and Statecraft - 2024,Article on how foreign one China policies shape Taiwan's constrained international personality,Helpful for connecting recognition practice to status and participation questions
lit-2025-aplr-hknsl-abuse-fundamental-rights,Article 2 of the Hong Kong National Security Law and the prohibition of abuse of fundamental rights,,Literature,Xiaoshan Zhang,2025-07-21,one-country-two-systems;sovereignty-non-interference;dispute-settlement,Scholarly literature,English,https://www.tandfonline.com/doi/abs/10.1080/10192557.2025.2493708,10.1080/10192557.2025.2493708,Xiaoshan Zhang - Article 2 of the Hong Kong National Security Law and the prohibition of abuse of fundamental rights - Asia Pacific Law Review - 2025,Article examining how Article 2 of the HKNSL reshapes rights review in Hong Kong,Useful for the autonomy and constitutional order dimensions of Hong Kong security law
lit-2025-jufil-attack-taiwan-lawfulness,How future actions might affect the lawfulness of an attack on Taiwan,,Literature,Rowan Nicholson,2025-11,one-country-two-systems;use-of-force;sovereignty-non-interference,Scholarly literature,English,https://www.tandfonline.com/doi/abs/10.1080/20531702.2025.2578120,10.1080/20531702.2025.2578120,Rowan Nicholson - How future actions might affect the lawfulness of an attack on Taiwan - Journal on the Use of Force and International Law - 2025,Article testing how recognition policy and subsequent conduct could affect legal narratives around Taiwan conflict,Adds a current jus ad bellum lens to Taiwan contingency debates
lit-2025-jogss-china-russia-sanctions-implementation,Putting Your Money Where Your Mouth Is Not - China and Russia's Implementation of Economic Sanctions,,Literature,Victor A Ferguson,2025-04-04,sanctions-anti-sanctions;global-economic-system;theory-order,Scholarly literature,English,https://academic.oup.com/jogss/article/10/3/ogaf010/8105843,10.1093/jogss/ogaf010,Victor A Ferguson - Putting Your Money Where Your Mouth Is Not - Journal of Global Security Studies - 2025,Article comparing how China and Russia implement formal and informal sanctions,Strong empirical bridge between economic coercion theory and Chinese practice
lit-2025-wq-old-logic-economic-weapons,The Old Logic Behind China's New Economic Weapons,,Literature,Viking Bohman and Audrye Wong and Victor A Ferguson,2025-09-29,sanctions-anti-sanctions;global-economic-system;theory-order,Scholarly literature,English,https://www.tandfonline.com/doi/abs/10.1080/0163660X.2025.2554476,10.1080/0163660X.2025.2554476,Viking Bohman Audrye Wong and Victor A Ferguson - The Old Logic Behind China's New Economic Weapons - The Washington Quarterly - 2025,Article arguing that new formal sanctions tools complement rather than replace China's informal coercive toolkit,Useful for tracking post-trade-war evolution in Chinese sanctions statecraft
lit-2025-jcps-expanding-influence-membership,Expanding China's Influence via Membership - Examining the Influence of Chinese-Led International Institutions on Responses to Human Rights Issues in China,,Literature,Hyunkyu Kim and Sanghoon Park,2024-04-03,theory-order;sovereignty-non-interference;global-economic-system,Scholarly literature,English,https://link.springer.com/article/10.1007/s11366-024-09886-2,10.1007/s11366-024-09886-2,Hyunkyu Kim and Sanghoon Park - Expanding China's Influence via Membership - Journal of Chinese Political Science - 2025,Article on how Chinese-led institutional memberships correlate with softer criticism of China in UN human rights review,Useful for linking institution-building to normative influence and human rights order contestation
lit-2025-pkulj-cicc-cross-border-mechanism,A comparative study of the China International Commercial Court as a cross-border dispute resolution mechanism,,Literature,Serena Cicy Liu,2025-12-07,dispute-settlement;belt-and-road;global-economic-system,Scholarly literature,English,https://www.tandfonline.com/doi/abs/10.1080/20517483.2025.2561305,10.1080/20517483.2025.2561305,Serena Cicy Liu - A comparative study of the China International Commercial Court as a cross-border dispute resolution mechanism - Peking University Law Journal - 2025,Compares the CICC with other cross-border dispute-resolution mechanisms and evaluates its institutional role and limits.,Recent source on China-centred transnational commercial dispute settlement.
lit-2024-ssrn-us-china-sanctions-war,The Lawfulness of Unilateral Sanctions in the Wake of a US-China Sanctions War,,Literature,Joshua Andresen,2024-02-05,sanctions-anti-sanctions;global-economic-system;theory-order,Scholarly literature,English,https://papers.ssrn.com/sol3/papers.cfm?abstract_id=4690995,10.2139/ssrn.4690995,Joshua Andresen - The Lawfulness of Unilateral Sanctions in the Wake of a US-China Sanctions War - SSRN - 2024,Chapter-length preprint on the legality and normalization effects of US-China sanctions escalation,Useful for situating Chinese anti-sanctions arguments within wider sanctions law debates
lit-2026-ejil-unclos-confrontation,International Law as a Driver of Confrontation? UNCLOS and China's Policy in the South China Sea,,Literature,Andrew Chubb,2026-01-08,use-of-force;sovereignty-non-interference;dispute-settlement;theory-order,Scholarly literature,English,https://academic.oup.com/ejil/article/36/4/891/8417583,10.1093/ejil/chaf066,Andrew Chubb - International Law as a Driver of Confrontation? UNCLOS and China's Policy in the South China Sea - European Journal of International Law - 2026,Shows how China's internalization of UNCLOS concepts helped create incentives for later maritime rights assertion and confrontation in the South China Sea.,Key recent bridge between law of the sea doctrine and maritime practice.
tt-2024-csis-quarantine-taiwan,Responding to a More Coercive Chinese Coast Guard and a Potential PRC Quarantine of Taiwan,,Think tank report,Center for Strategic and International Studies,2024-06-07,one-country-two-systems;use-of-force;sovereignty-non-interference;dispute-settlement,Foreign,English,https://www.csis.org/analysis/responding-more-coercive-chinese-coast-guard-and-potential-prc-quarantine-taiwan,,Christopher B Johnstone and Bonny Lin - Responding to a More Coercive Chinese Coast Guard and a Potential PRC Quarantine of Taiwan - CSIS - 2024,CSIS commentary on quarantine scenarios and the legal framing of China Coast Guard operations,Useful for gray zone escalation law enforcement narratives and Taiwan contingency planning
lit-2021-chinesejil-community-shared-future-legalist-turn,The Community of Shared Future for Mankind and China's Legalist Turn in International Relations,,Literature,Ignacio de la Rasilla and Hao Yayezi,2021-06-01,theory-order;sovereignty-non-interference,Scholarly literature,English,https://doi.org/10.1093/chinesejil/jmab021,10.1093/chinesejil/jmab021,Ignacio de la Rasilla and Hao Yayezi - The Community of Shared Future for Mankind and China's Legalist Turn in International Relations - Chinese Journal of International Law - 2021,Article tracing the evolution of community of shared future language and its connection to legalist approaches in Chinese international relations,Key source on how a central diplomatic slogan is translated into international legal vocabulary
lit-2021-cjcl-global-constitutionalism-common-destiny-future-intl-law,"Chinese Positions on Global Constitutionalism, Community of Common Destiny for Mankind, and the Future of International Law",,Literature,Bjorn Ahl,2021-10-25,theory-order;sovereignty-non-interference,Scholarly literature,English,https://doi.org/10.1093/cjcl/cxab011,10.1093/cjcl/cxab011,Bjorn Ahl - Chinese Positions on Global Constitutionalism Community of Common Destiny for Mankind and the Future of International Law - The Chinese Journal of Comparative Law - 2021,Article comparing global constitutionalism discourse with Chinese common destiny thinking about the future international legal order,Useful comparative reading on whether Chinese order discourse reworks or rejects universalist legal narratives
lit-2024-io-reconceptualizing-international-order,Reconceptualizing International Order: Contemporary Chinese Theories and Their Contributions to Global IR,,Literature,Haoming Xiong and David A Peterson and Bear F Braumoeller,2024-08-02,theory-order;sovereignty-non-interference,Scholarly literature,English,https://www.cambridge.org/core/journals/international-organization/article/reconceptualizing-international-order-contemporary-chinese-theories-and-their-contributions-to-global-ir/3EA614FBF13A5DDAB159F00354451865,10.1017/S0020818324000171,Haoming Xiong David A Peterson and Bear F Braumoeller - Reconceptualizing International Order - International Organization - 2024,Review essay on leading contemporary Chinese theories of international order within Global IR,Strong synthetic entry point to non-Western theories of order and their relationship to Chinese foreign policy
lit-2025-ia-beyond-liberal-narratives-human-rights-order,Beyond liberal narratives: China and the international human rights order,,Literature,Xinyuan Dai and Lucie Lu,2025-03-03,theory-order;sovereignty-non-interference,Scholarly literature,English,https://academic.oup.com/ia/article/101/2/459/8045976,10.1093/ia/iiae331,Xinyuan Dai and Lucie Lu - Beyond liberal narratives: China and the international human rights order - International Affairs - 2025,Article using UN human rights review data to show how China reshapes parts of the international human rights order,Important bridge between sovereignty discourse human rights governance and Chinese influence in the Global South
lit-2025-eia-china-international-justice-research-agenda,China and international justice: a research agenda,,Literature,Tadhg O Laoghaire,2025-11-06,theory-order;global-economic-system,Scholarly literature,English,https://www.tandfonline.com/doi/full/10.1080/13698230.2025.2561317,10.1080/13698230.2025.2561317,Tadhg O Laoghaire - China and international justice: a research agenda - Ethics and International Affairs - 2025,Review article on how China's rise raises questions for theories of international justice and global order,Useful normative companion to legal and policy debates about superpower competition and reform of global institutions
lit-2024-east-asia-multilateralism-soft-power-made-in-china,Multilateralism and Soft Power Made-in-China: (re)Adjusting Role Conception to Meet International Expectations,,Literature,Paulo Afonso Brardo Duarte and Amit Gupta and Bruna Cristina Delvaje,2024-03-05,theory-order;global-economic-system,Scholarly literature,English,https://link.springer.com/article/10.1007/s12140-024-09424-0,10.1007/s12140-024-09424-0,Paulo Afonso Brardo Duarte Amit Gupta and Bruna Cristina Delvaje - Multilateralism and Soft Power Made-in-China - East Asia - 2024,Article on Xi-era multilateralism and soft power as complementary strategies for China's role conception,Useful IR framing for China's selective multilateralism and institutional image-building
lit-2024-jufil-peacetime-maritime-law-enforcement-warships,Peacetime Maritime Law Enforcement by Warships,,Literature,Deyi Ma and Yanlin Zhou,2024-10-14,use-of-force;sovereignty-non-interference;dispute-settlement,Scholarly literature,English,https://www.tandfonline.com/doi/abs/10.1080/20531702.2024.2411128,10.1080/20531702.2024.2411128,Deyi Ma and Yanlin Zhou - Peacetime Maritime Law Enforcement by Warships - Journal on the Use of Force and International Law - 2024,Article on the evolving legal scope of maritime law enforcement by warships in peacetime,Important for coast-guard and naval enforcement debates around gray-zone coercion and maritime order
lit-2024-njhr-authoritarian-governance-human-rights-china,Navigating Tensions between Authoritarian Governance and Human Rights: Towards a Business and Human Rights Regime within China's Dual-State Context,,Literature,Xu Kang,2024-11-04,sovereignty-non-interference;theory-order;global-economic-system,Scholarly literature,English,https://www.tandfonline.com/doi/abs/10.1080/18918131.2024.2415197,10.1080/18918131.2024.2415197,Xu Kang - Navigating Tensions between Authoritarian Governance and Human Rights - Nordic Journal of Human Rights - 2025,Article on how China's evolving business and human rights regime operates within a dual-state framework,Adds a rights-governance lens that connects domestic political structure with global human-rights expectations
lit-2025-fudan-environmental-diplomacy-bri,The Environmental Diplomacy of the Belt and Road Initiative: Going Green to Meet External Expectations,,Literature,Paulo Afonso B Duarte and Asya Gasparyan and Flavio Bastos da Silva and Antonio Tavares,2025-07-18,belt-and-road;global-economic-system;theory-order,Scholarly literature,English,https://link.springer.com/article/10.1007/s40647-025-00453-4,10.1007/s40647-025-00453-4,Paulo Afonso B Duarte and others - The Environmental Diplomacy of the Belt and Road Initiative - Fudan Journal of the Humanities and Social Sciences - 2025,Article on the Green Silk Road as a role-adjustment strategy for China under external pressure,Useful for showing how BRI governance adapts to international expectations while sustaining order-building ambitions
lit-2023-book-chinas-law-of-the-sea,China's Law of the Sea: The New Rules of Maritime Order,,Literature,Isaac B Kardon,2023-04-17,use-of-force;sovereignty-non-interference;dispute-settlement;theory-order,Scholarly literature,English,https://yalebooks.yale.edu/2023/04/17/chinas-law-of-the-sea/,,Isaac B Kardon - China's Law of the Sea: The New Rules of Maritime Order - Yale University Press - 2023,Book on China's bid to shape law of the sea rules and regional maritime order,Strong book-length treatment of how China uses legal argument and enforcement capacity in maritime order making
lit-2025-ejis-mekong-security-development-nexus,Ponder the path of thy feet: How China's security-development nexus works in the Mekong region,,Literature,Xue Gong,2025-02-20,use-of-force;theory-order;sovereignty-non-interference,Scholarly literature,English,https://www.cambridge.org/core/journals/european-journal-of-international-security/article/ponder-the-path-of-thy-feet-how-chinas-securitydevelopment-nexus-works-in-the-mekong-region/8278F8CC16039DEBAAAD86AA1329076B,10.1017/eis.2025.5,Xue Gong - Ponder the path of thy feet - European Journal of International Security - 2025,Article on China's security-development nexus and South-South security cooperation in the Mekong region,Useful for tracing how development and security blend in China's regional order-building
lit-2025-ripe-status-quo-revisionist-trade-regime,Challenging the status quo-revisionist power dichotomy: China and the United States in the trade regime,,Literature,Kristen Hopewell,2025-04-29,global-economic-system;theory-order;dispute-settlement,Scholarly literature,English,https://www.tandfonline.com/doi/full/10.1080/09692290.2025.2493802,10.1080/09692290.2025.2493802,Kristen Hopewell - Challenging the status quo-revisionist power dichotomy - Review of International Political Economy - 2025,Article arguing that WTO conflicts show the limits of the status-quo versus revisionist dichotomy for US-China order debates,Useful for economic-order analysis that avoids simplistic labels for China and the United States
lit-2025-ripe-multilateralism-a-la-carte,Multilateralism a la carte: how China navigates global economic institutions,,Literature,Eugenia C Heldt and Henning Schmidtke and Omar Serrano Oswald,2025-05-15,global-economic-system;theory-order,Scholarly literature,English,https://www.tandfonline.com/doi/full/10.1080/09692290.2025.2495694,10.1080/09692290.2025.2495694,Eugenia C Heldt Henning Schmidtke and Omar Serrano Oswald - Multilateralism a la carte - Review of International Political Economy - 2025,Article proposing a framework for China's selective engagement with global economic institutions,Helpful synthesis for comparing deep cooperation shallow support and deeper challenge across economic governance
lit-2026-ripe-institutional-layering-gdi,Institutional layering as (counter-)hegemonic strategy: unpacking China's global development initiative,,Literature,Jack Taggart and Han Cheng and Sebastian Haug,2026-03-26,theory-order;global-economic-system;belt-and-road,Scholarly literature,English,https://www.tandfonline.com/doi/full/10.1080/09692290.2026.2646945,10.1080/09692290.2026.2646945,Jack Taggart Han Cheng and Sebastian Haug - Institutional layering as (counter-)hegemonic strategy - Review of International Political Economy - 2026,Article on the Global Development Initiative as layered order-building within UN-centered frameworks,Important new source on how Chinese initiatives complement and contest existing global governance at the same time
tt-2025-carnegie-ai-safety-institute,How Some of China's Top AI Thinkers Built Their Own AI Safety Institute,,Think tank report,Carnegie Endowment for International Peace,2025-06-16,global-economic-system;theory-order;sovereignty-non-interference,Foreign,English,https://carnegieendowment.org/research/2025/06/how-some-of-chinas-top-ai-thinkers-built-their-own-ai-safety-institute,,Scott Singer Karson Elmgren and Oliver Guest - How Some of China's Top AI Thinkers Built Their Own AI Safety Institute - Carnegie Endowment - 2025,Report on the emergence of China's AI Safety and Development Association and its role in global AI governance,Adds a current bridge between Chinese AI governance institutions and international norm shaping
tt-2025-usip-police-assistance-global-security,How China Uses Police Assistance to Reshape Global Security,,Think tank report,United States Institute of Peace,2025-03-12,use-of-force;theory-order;sovereignty-non-interference,Foreign,English,https://www.usip.org/publications/2025/03/how-china-uses-police-assistance-reshape-global-security,,Ena Dion and Matt Herbert - How China Uses Police Assistance to Reshape Global Security - USIP - 2025,Analysis of China's use of foreign law-enforcement assistance to reshape security governance,Useful shorter policy companion to larger GSI and international policing reports
tt-2025-carnegie-foreign-police-training,China's Foreign Police Training: A Global Footprint,,Think tank report,Carnegie Endowment for International Peace,2025-11-13,use-of-force;theory-order;sovereignty-non-interference,Foreign,English,https://carnegieendowment.org/russia-eurasia/research/2025/11/chinas-foreign-police-training-a-global-footprint,,Sheena Chestnut Greitens Isaac B Kardon and Cameron Waltz - China's Foreign Police Training: A Global Footprint - Carnegie Endowment - 2025,Data-rich report on China's worldwide police and internal security training programs,Important evidence base for China's attempt to remake parts of global security governance through training and capacity building
lit-2026-aplr-data-export-regime,China's data export regime: an evolutionary trajectory and its practical challenges,,Literature,Guang Ma and Hong Wu,2026-05-02,global-economic-system;sovereignty-non-interference;sanctions-anti-sanctions,Scholarly literature,English,https://www.tandfonline.com/doi/abs/10.1080/10192557.2026.2667354,10.1080/10192557.2026.2667354,Guang Ma and Hong Wu - China's data export regime: an evolutionary trajectory and its practical challenges - Asia Pacific Law Review - 2026,"Traces China's outbound data transfer regime through security assessment, standard contracts, certification, and free-trade-zone negative lists, emphasizing legal certainty and interoperability challenges.",Important recent source on cross-border data governance and economic security.
lit-2026-aplr-public-participation-cai,Establishing Democracy in Foreign Direct Investment: Opportunities and Limitations of Integrating the Principle of Public Participation in the CAI,,Literature,E-nuo Gu and Qing Zhao,2026-04-19,global-economic-system;dispute-settlement;theory-order,Scholarly literature,English,https://www.tandfonline.com/doi/abs/10.1080/10192557.2026.2660622,10.1080/10192557.2026.2660622,E-nuo Gu and Qing Zhao - Establishing Democracy in Foreign Direct Investment: Opportunities and Limitations of Integrating the Principle of Public Participation in the CAI - Asia Pacific Law Review - 2026,"Assesses how public participation, transparency, sustainable development, and amicus mechanisms in the EU-China CAI could affect legitimacy in investment governance.",Adds an investment-law democracy and legitimacy angle to China-EU economic governance.
lit-2026-aplr-lender-last-resort,"Lender of last resort in China: operating mechanism, legal foundation, and the financial stability implications",,Literature,Ci Ren and Lerong Lu,2026-01-01,global-economic-system;theory-order,Scholarly literature,English,https://www.tandfonline.com/doi/abs/10.1080/10192557.2025.2493702,10.1080/10192557.2025.2493702,"Ci Ren and Lerong Lu - Lender of last resort in China: operating mechanism, legal foundation, and the financial stability implications - Asia Pacific Law Review - 2026","Examines the People's Bank of China's lender-of-last-resort role, legal authority, information asymmetries, moral hazard, and reforms for financial stability.",Useful for the economic-order dossier on financial safety-net governance.
lit-2026-aplr-return-of-states,The return of the states: constitutional dilemmas of state measures to defend national and state security,,Literature,Joel Slawotsky,2026-02-11,sovereignty-non-interference;use-of-force;global-economic-system;sanctions-anti-sanctions,Scholarly literature,English,https://www.tandfonline.com/doi/full/10.1080/10192557.2026.2626055,10.1080/10192557.2026.2626055,Joel Slawotsky - The return of the states: constitutional dilemmas of state measures to defend national and state security - Asia Pacific Law Review - 2026,Analyzes U.S. state-level measures responding to China-related security concerns and the constitutional boundary between state power and federal foreign affairs authority.,Connects China-related security policy to foreign relations federalism and economic statecraft.
